<?xml version="1.0" encoding="utf-8"?>
<xs:schema id="IFCSUM_FYCW" targetNamespace="http://tempuri.org/IFCSUM_FYCW.xsd" xmlns:mstns="http://tempuri.org/IFCSUM_FYCW.xsd" xmlns="http://tempuri.org/IFCSUM_FYCW.xsd" xmlns:xs="http://www.w3.org/2001/XMLSchema" xmlns:msdata="urn:schemas-microsoft-com:xml-msdata" xmlns:msprop="urn:schemas-microsoft-com:xml-msprop" attributeFormDefault="qualified" elementFormDefault="qualified">
  <xs:annotation>
    <xs:appinfo source="urn:schemas-microsoft-com:xml-msdatasource">
      <DataSource DefaultConnectionIndex="0" FunctionsComponentName="QueriesTableAdapter" Modifier="AutoLayout, AnsiClass, Class, Public" SchemaSerializationMode="IncludeSchema" xmlns="urn:schemas-microsoft-com:xml-msdatasource">
        <Connections />
        <Tables />
        <Sources />
      </DataSource>
    </xs:appinfo>
  </xs:annotation>
  <xs:element name="IFCSUM_FYCW" msdata:IsDataSet="true" msdata:UseCurrentLocale="true" msprop:Generator_DataSetName="IFCSUM_FYCW" msprop:Generator_UserDSName="IFCSUM_FYCW" msprop:EnableTableAdapterManager="true">
    <xs:complexType>
      <xs:choice minOccurs="0" maxOccurs="unbounded">
        <xs:element name="EDI" msprop:Generator_UserTableName="EDI" msprop:Generator_RowDeletedName="EDIRowDeleted" msprop:Generator_TableClassName="EDIDataTable" msprop:Generator_RowChangedName="EDIRowChanged" msprop:Generator_RowClassName="EDIRow" msprop:Generator_RowChangingName="EDIRowChanging" msprop:Generator_RowEvArgName="EDIRowChangeEvent" msprop:Generator_RowEvHandlerName="EDIRowChangeEventHandler" msprop:Generator_TablePropName="EDI" msprop:Generator_TableVarName="tableEDI" msprop:Generator_RowDeletingName="EDIRowDeleting">
          <xs:complexType>
            <xs:sequence>
              <xs:element name="EDIDATA" msprop:Generator_UserColumnName="EDIDATA" msprop:Generator_ColumnPropNameInRow="EDIDATA" msprop:Generator_ColumnVarNameInTable="columnEDIDATA" msprop:Generator_ColumnPropNameInTable="EDIDATAColumn" type="xs:string" minOccurs="0" />
            </xs:sequence>
          </xs:complexType>
        </xs:element>
      </xs:choice>
    </xs:complexType>
  </xs:element>
</xs:schema>