<?xml version="1.0" encoding="UTF-8"?>
<IFCSUM_FYCW xmlns="http://tempuri.org/IFCSUM_FYCW.xsd" xsi:schemaLocation="http://tempuri.org/IFCSUM_FYCW.xsd D:/Project/ICP2005/LongWin.EDI/LongWin.EDI.FileManager/IFCSUM_FYCW.xsd" xmlns:xsi="http://www.w3.org/2001/XMLSchema-instance">
  <EDI>
    <EDIDATA>00:IFCSUM:MANIFEST:2:TOP:POSASZ:201007291028'</EDIDATA>
  </EDI>
  <EDI>
    <EDIDATA>10::HATSU COURAGE::.0627E::::20100717:CNYTN:YANTIAN:::'</EDIDATA>
  </EDI>
  <EDI>
    <EDIDATA>11:CSCL:中海集装箱运输股份有限公司'</EDIDATA>
  </EDI>
  <EDI>
    <EDIDATA>12:CHNJYTNLAX111756::::::CNYTN:YANTIAN:CY-CY:C:20100716::::YTNLAX111756::19328:::::LOS ANGELES,CAM/BL'</EDIDATA>
  </EDI>
  <EDI>
    <EDIDATA>13:USLAX:LOS ANGELES,CA:USLAX:LOS ANGELES,CA:USLAX:LOS ANGELES,CA:CNCAN:GUANGZHOU:11'</EDIDATA>
  </EDI>
  <EDI>
    <EDIDATA>16:TOPSHIPPINGCN:TOP SHIPPING LOGISTICS CO.,LIMITED  22/F, A Bldg., Aerospace Skyscraper No. 4019, Shennan Road, Futian District, Shenzhen, china::86755 3395 8231:86755 3395 8201'</EDIDATA>
  </EDI>
  <EDI>
    <EDIDATA>17:COLA-LA:CITY OCEAN INTERNATIONAL INC., (LOS ANGELES OFFICE)  17890 CASTLETON ST.#205  CITY OF INDUSTRY,CA91748::626 810 0261:626 810 0251'</EDIDATA>
  </EDI>
  <EDI>
    <EDIDATA>18:COLA-LA:CITY OCEAN INTERNATIONAL INC., (LOS ANGELES OFFICE)  17890 CASTLETON ST.#205  CITY OF INDUSTRY,CA91748::626 810 0261:626 810 0251'</EDIDATA>
  </EDI>
  <EDI>
    <EDIDATA>19::'</EDIDATA>
  </EDI>
  <EDI>
    <EDIDATA>21:TOPSHIPPINGCN:TOP SHIPPING LOGISTICS CO.,LIMITED  22/F, A Bldg., Aerospace Skyscraper No. 4019, Shennan Road, Futian District, Shenzhen, china::86755 3395 8231:86755 3395 8201'</EDIDATA>
  </EDI>
  <EDI>
    <EDIDATA>22:COLA-LA:CITY OCEAN INTERNATIONAL INC., (LOS ANGELES OFFICE)  17890 CASTLETON ST.#205  CITY OF INDUSTRY,CA91748::626 810 0261:626 810 0251'</EDIDATA>
  </EDI>
  <EDI>
    <EDIDATA>23:COLA-LA:CITY OCEAN INTERNATIONAL INC., (LOS ANGELES OFFICE)  17890 CASTLETON ST.#205  CITY OF INDUSTRY,CA91748::626 810 0261:626 810 0251'</EDIDATA>
  </EDI>
  <EDI>
    <EDIDATA>24:::::'</EDIDATA>
  </EDI>
  <EDI>
    <EDIDATA>25:::::'</EDIDATA>
  </EDI>
  <EDI>
    <EDIDATA>41:1::413::CTNS:6787.00000::66.97000:'</EDIDATA>
  </EDI>
  <EDI>
    <EDIDATA>44:N/M'</EDIDATA>
  </EDI>
  <EDI>
    <EDIDATA>47:SHIPPER'S LOAD COUNT &amp; SEAL(1*  40HQ) CONTAINER S.T.C.    CY-CY  ACCEN'</EDIDATA>
  </EDI>
  <EDI>
    <EDIDATA>47:T TABLES  COMM:FAK  HB/L:GZLAXJG0230  SCAC:CTYO  NO WOOD PACKAGING MAT'</EDIDATA>
  </EDI>
  <EDI>
    <EDIDATA>47:ERIAL IS   USED IN THE SHIPMENT'</EDIDATA>
  </EDI>
  <EDI>
    <EDIDATA>51:1:TGHU9578039:K312691:40HQ:F:413:6787.00000::66.97000::::::'</EDIDATA>
  </EDI>
  <EDI>
    <EDIDATA>99:21'</EDIDATA>
  </EDI>
</IFCSUM_FYCW>
